dyu,fr,dyu_len,fr_len
nin kuma nin kɔrɔkodi,que signifie ce mot ,21,20
nunu kanuna,eux ils ont été aimé,11,20
a ka cɛn kaɲi,elle est jolie votre raison …,13,29
sɛzi nin kari la,la chaise est cassée,16,20
a bi bara juma le jɛ,quel métier faitesvous ,20,23
a yi a kana ta,non ne partez pas ,14,18
cɛn tun ba fɛ,elle avait raison,13,17
aw bi se ka sɔrɔ,vous pouvez la trouver,16,22
i bi fɛ mun lo kɛ,questce tu veux faire,17,21
ni n nana a bina ta,si je viens il partira,19,22
ji beyi,il y a de leau ,7,15
kana hakili gɛlɛya,ne complique pas mon esprit,18,27
i ti na sogo n na,tu ne vas pas me cacher ,17,24
n ma filière,je ne me trompe pas…,12,20
mɔgɔdeni nunu,les petites gens,13,16
aw bi na da yɛlɛ,ouvrirezvous la porte ,16,22
a tu bi tlo kɛra ni ye,elle jouait avec toi,22,20
o bɛɛ ka ɲi,ils sont tous bons,11,18
n bi jabi nunu kɔnɔ na,j’entends ces réponses,22,22
a fɔ kɔm ale,faut dire comme lui,12,19
sɔrɔ ka ɲi o yɔrɔ la,la production y est bonne,20,25
an bi kɛ lon wɛrɛ ne balimancɛ kursɔn ,au revoir monsieur de courson,38,29
a bi filɛni kɛra ka toka tɛmɛ,il regarde en traversant,29,24
n ti kuma n ba kɛ le,je ne parle pas j’agis,20,22
tumami o tun tara,quand ils sont partis,17,21
a ka misi dɛndɛla ya laminɛ,oui répondit le berger,27,22
jarabi bi aw fɛ,vous avez un amoureux ,15,22
n kanɲi ka joli le di aw ma,combien je vous dois ,27,21
a bi na mule kɛ,qu’estce que vous ferez ,15,24
sisan a kaɲ,maintenant cest bien,11,20
a tun sera mɔgɔ duuru nan man,il était arrivé le cinquième,29,28
a tun be i fana,vous étiez là également ,15,24
muso a ye oo,madame c’est que…,12,17
kɔntɛs ya jaabi,répondit la comtesse,15,20
sériel foyi ti yɛlɛ fangara,nulle serrure à forcer,27,22
e ti digura wa ɔn ɔn,vous nêtes pas du pays non,20,26
ari ka sira kɔnɔtɔn na,route darry au numéro neuf,22,26
sepwa sira recɛsi,chemin de seppois réchésy,17,25
an bi na metro sɔrɔmi,où y auraitil un métro ,21,23
a ye tɛmɛ kɛsi ra,passez à la caisse ,17,19
bɛgɛn wɛrɛw,dautres animaux,11,15
anw kɔrɔ ɛrnɛsi,ernest notre aîné,15,17
a wɔ n pɛrɛni lo,oui je suis prêt,16,16
sɔni kasa,l’odeur de roussi,9,17
yiriladan ye ziyeut le ye,floraison de juillet à août,25,27
ana hakili sigi,cela nous rassurerait,15,21
a le to kuma ye,mais là n’est pas le sujet,15,26
a yo fla bɛ faga,il les abattit tous les deux,16,28
an wilila ka bɔ tabali kan,vous vous étiez levé de table,26,29
film daksiyɔn le kadi n ye,je préfère les films daction,26,28
i laniba ra ko bina diy a ye wa ,tu es sûr quil aurait aimé,32,26
ɔnɔn o tɛ tana lo,non pas ça c’est sacré ,17,23
kenɛt ko bi na son,jobéirai ajouta keinec,18,22
o ye min minɛ o tɛmɛna kelen kan,plus d’un avait été pris,32,24
tasuma ma taa koyi,le feu ne partit pas,18,20
ayiwa o bi see ka kɛ,eh bien cela pourra se faire,20,28
aw kungolo saba,vos trois têtes,15,15
i ka sɛbɛ bi tabali ɲafɛ,le livre est devant la table,24,28
panplona tun ya ka kapital le ye,sa capitale était pamplona,32,26
i ti dumuni caaman kɛ,tu manges bien peu,21,18
saya kɔni kaɲi,mourir c’est bien bon,14,21
a bi di san tuma bɛɛ,elle est remise annuellement,20,28
an bi nin yɔrɔ le fɛ,nous avons besoin de ce rayon,20,29
ɔnɔn i bi dɔgɔcɛ mɛn na ,non tu entends ton frère ,24,25
a yi dumuni kɛ a ,vous avez mangé ,17,16
ne bi yaada,et je m’en vante…,11,17
a ya lalɔ ni fanga ye,interrompitil avec rudesse,21,26
ale ka ça,cela fait beaucoup,9,18
jɔn le ye lɛttrɛ ni ci,qui a expédié cette lettre ,22,27
ɔnhɔn mesiye a be ten le,non monsieur c’est certain,24,26
a bi na daraka kolon le kɛ,vous déjeunerez bien mal,26,24
zolapɛt le wa,c’est jolarpet ,13,15
a be boni parkɛr lo ɛntɛrprɛtera,elle interprète bonnie parker,32,29
a ka jan,elle est vraiment grande,8,24
n ti na sigɛ,je ne le souffrirais pas,12,24
a bi na yɛlɛma tuma juma,quand allezvous déménager ,24,26
n lanibala ko a kun bina diya n ye,je suis sûr que j’aurais aimé,34,29
a sigɛ na wa,êtesvous fatigué ,12,17
a ye ɲɔngɔn kanu,vous vous êtes aimés,16,20
a tɔgɔ ko di,quel est son nom ,12,17
a ni sɔgɔma mesie,bonjour monsieur,17,16
juma le kaɲi,laquelle est la meilleure ,12,26
a ba alugu fɛ ɔhon,lavezvous sur vous oui,18,22
cɛ ni ti tulon kɛ,monsieur ne s’amuse pas ,17,24
n tina foyi fɔ,je ne dirai rien,14,16
a tugula kɔ,boishardy le suivit,11,19
nne ye baliman le ye,cest moi … le parrain ,20,22
ni ye mɔgɔ fɛn ta a maɲ,le plagiat cest mal,23,19
nne kun bi furula,je me mariai donc,17,17
mɔgɔw bi ɲɔgɔn don na,la masse piétinait,21,18
an ka tuma,quand nous étions,10,17
sisan mankan jigira,d’abord le son coupe,19,20
lavis ka kɛlɛ,combat du lavis,13,15
a tɔgɔ jig dɛstritiɔn ba ɲinigala,votre nom demanda le juge dinstruction,33,38
a ye lɛttri sɛbɛ an ma,elle lui écrivit une lettre,22,27
dugutigi ba an kɔrɔ,le roi serra de plus près,19,25
a bɛ bi na nɔgɔya,tout cela va se stabiliser,17,26
a ye lɛtri sɛbɛ a ma,il lui écrivit une lettre,20,25
bɛrnar tun bi oreli le fɛ,bernard aimait aurélie,25,22
a bɛn na juman ne man,quavezvous décidé ,21,18
ne ye mlle catherine ye,je suis mlle catherine,23,22
cɛn bi mese terase fɛ,monsieur terrasse a raison,21,26
an bi baro wɛrɛ le kɛra,nous abordons un autre sujet,23,28
a dan yi yan le ye,la etait la limite,18,18
ale fana sɔngɔ ka ca,c’est tout aussi cher,20,21
i belen ba kelen nin le ye,tu es toujours le même,26,22
i yo nɛni,et tu les as insultés,9,21
wotoroba,le grand chariot,8,16
i laniba ra ka bina diya a ye,tu es sûr qu’il aimerait,29,24
nin te sɛbɛ ye,ceci nest pas un livre,14,22
cɛ nin bi bonkelen le fɛ a ,monsieur désire une chambre ,27,28
samara kelen,une paire de chaussures,12,23
kalanyɔrɔ ɲanaman le,cest une bonne école,20,20
sigɛn yɛrɛ yɛrɛ,extrêmement fatigué,15,19
wulu tun ba la bon kɔnɔ,le chien était dans sa niche,23,28
ale lo bina a boli,cest lui qui conduira,18,21
a kelen le bi ɲan ,vous êtes ici tout seul ,18,24
o ba nɔrɔ kogo kan,on laffiche sur les murs,18,24
dɛnmisɛn ɲanamanw,les bons petits enfants,17,23
a man kɛnɛ la ,vous êtes malade ,14,17
krɛp kadi ne ye,j’aime bien les crêpes,15,22
a ta ka fɔrmatiɔn yɛrɛlon,sa formation reste inconnue,25,27
a ka fisa,vous allez mieux ,9,17
maa bisaaba kɛlɛ,le combat des trente,16,20
dɔtɔrɔ sona,le médecin approuva,11,19
mɔgɔ ɲanaman,une personne de cœur,12,20
san kelen nɔnɔ ba labɔ,un an de lait suffit,22,20
i tagara filɛ,tu es allé voir,13,15
flaviɛn na yɛlɛla etazi kelen kan,flaviana monta un étage,33,23
jobɛr kun banno ra,jobert les avait refusés,18,24
mesie olivie ko ka ka mɔgɔ tɔrɔ,par caprice dit sir olliver,31,27
modɛl fɔlɔ le ye nin ye,cest un modèle premium,23,22
o tun yi mɔgɔ wolonfila le ye nin jama nin na,elles sont sept sur les rangs,45,29
sigarɛt min yɔrɔ cɛɲumani,un fumoir très élégant,25,22
nin dɔrɔn le n ya kɛ,c’est juste ce que j’ai fait,20,28
an ti foyi karila,on ne casse pourtant rien…,17,26
mɔgɔsi ti don,on n’entre pas …,13,16
o ma ale fin nunu kɛlɛ kɛ,ils nont pas été revendiqués,25,28
bu ka sira le ye nin ye ni ba fɛ ka ta madi ,rue de bou à mardié,44,19
an ba laban cogo di ,que peuton conclure de là ,20,26
an bi fanikota don segi kɔnɔ,on met le linge au panier,28,25
o ya tanu,elle était donc décorée,9,23
nin te sɔbɛ ye,cest amusant ça,14,15
san kura,le premier de l’an,8,18
n tun bini baden kanu,jaimerais ta sœur,21,17
fen miniw yɛlɛma na ka kɛ bliw ye,seymour devient alors blur,33,26
gaɲak sɛnjori ka sira le lo,chemin de gagnac saintjory,27,26
balanfɛnw tun bi mankan kɛra,les insectes bourdonnaient,28,26
anti foyi yera sisi ni kɔnɔ,on ne voit rien avec la brume,27,29
a bina to a nɔna,elle continuera de l’être,16,25
cɔmbɛrnoz sira fila solisiɔn ta ra,deux impasse combernoz,34,22
suu cɛɲumani,un trognon de chou,12,18
sugurusaramani eveline lɛrd ka belenden lo,miss eveline nièce du laird,42,27
bɛɛ ka kopikɛyɔrɔ so,salle cybercommune,20,18
sira sabanan tɔgɔ ko potɔn,rue port poton au numéro trois,26,30
pɔrtos tun kaba ra,oh fit porthos,18,14
ale a ka eme sɔrɔ,elle elle a eu aimé,17,19
yɛrɛkɔrɔsi kɛlitagali yɛfɛ ɲɛnɛjɛ kɛli la,protégé est développé en java,41,29
yɔrk nin mɔgɔ hakɛ de beyi,york compte environ habitants,26,29
siraba wolonfila bi ɲɔgɔn kunbɛn,sept rues sy raccordent,32,23
emovi donkili da yɔrɔ ɲuman,une vraie scène de teenmovie,27,28
ko olugu nɔgɔlebɛ o daletɛ ala kola,on est crasse et impie,35,22
pɔtland wɔrɔdugu ɲafan ka puɛt,la pointe nord de portland,30,26
ɲɔgɔnye nafaman,dune visite opportune,15,21
yiri filaburu yi brɛn marɔn le ye,ses rameaux sont brunmarron,33,27
ko kuraw tɛ,ce n’est pas un sujet nouveau,11,29
angilɛ kumakan,expressions et mots d’anglais,14,29
sɛk babitia wulu,cest que … balbutia médor,16,25
wala nbye n ka wari tunu tugu,je reperds mes arrhes…,29,22
cala zaponɛ mɔgɔjuguw tun ye kɔte sid mɔgɔw bagabaga,en effet la côte du sud était menacée par des pirates japonais,52,62
a bi mɔgɔ ɲaa minimini,ça en est vertigineux,22,21
mugan ni kelen bɔm ka kartie kan,vingt et un rue de beaume,32,25
ɲinigalikɛ minɛn gɛrɛfɛ,proche du questionnaire,23,23
a ba gosira a yɛrɛ tara,le comparant au sien,23,20
soo bolila lo,c’est un cavalier,13,17
brassure ni bâ chokô râ belgique,brassine rentre en belgique,32,27
kuma kelen kelen bɛ jatila,chaque mot compte a été pesé,26,28
nin papiɔn ni bi bɔ usitrali,ce papillon vit en australie,28,28
rensbur nana hanri fɛ,henri reçoit rendsburg,21,22
a bi bɔ halden,elle vit à halden,14,17
a lugu ye muso de ye wa,vous êtes une fille ,23,20
an ye saraka bɔ a ye,on lui a rendu hommage,20,22
o ye fanga don kɔrɔlekowla,la culture fut encouragée,26,25
i badeen musomani tɔgɔ ko di le,comment s’appelle votre sœur ,31,29
papa ubi n ye ni ye,père ubu me voilà me voilà ,19,27
kurusi ni dɛrɛnin bɛ kɔsɔbɛ,un pantalon trop serré,27,22
an bi se ka yɔrɔdɔ lue wa,vous voulez louer un film ,25,26
a sinɔgɔra kaɲɛ a,avezvous bien dormi,17,19
an ga sigilan bi mi,où sont nos chaises ,19,20
yiri yi a munumunu,il est environné de bois,18,24
ko déni lo,c’est une contrainte légère,10,27
bi ni kibaria di,je vais vous livrer un scoop,16,28
markɔf hakili sigira,marcof dévora son impatience,20,28
bisaaba ni kɔnɔton yɔrɔfila bilange dakarikan,trenteneuf bis rue bellanger,45,28
fani figɛmani,les sablés légers,13,17
waton sugukɔnɔna vɛbɛn kare kan,rue de waben à verton,31,21
kuma kelen kelen bɛ jatira,chaque mot compte a été pesé,26,28
aw ya ye wa sankolo bi jigira tuguni,vous avez vu il neige encore,36,28
pariziɛn naloman,connards de parisiens,16,21
sama cɛɲumani den bisaaba ni duuru,trentecinq beaux éléphants,34,26
a ka fari bonni lo ra,son point fort est le tir,21,25
dugutigi dencɛ erik ni badenmuso saba le,erik prince a trois sœurs,40,25
ala ka sijan di mama ubo ma,vive la mère ubu,27,16
sira kelen durɔn le sɛbɛra,une seule scène est écrite,26,26
an tun bi tara min lo ,où allionsnous ,22,15
kɛ o yɔrɔ la wagati la,soisy à lheure ,22,15
sigaliz tun laniba ra,cydalise en était sûre,21,22
yɔrɔbɛɛ bɛɛ ta,partout pour tous,14,17
fugulan den fila yɛrɛ lo,c’est même deux chapeaux ,24,25
a sigi yoro bi wigit,son siège est wiggins,20,21
en sigé na fêti déni na,assez de ces petites fêtes ,23,27
i kun ta dabila,cesse de faire la tête ,15,23
mogô chi koun ti kouma na,personne ne parlait,25,19
min bina kè a ka kè,advienne que pourra,19,19
a doussou ka di,elle est contente,15,17
a laminè oui ta on,réponds je ne sais pas,18,22
layuru nin bina dafa,l’engagement sera tenu,20,22
a tou bi fride ka yôrô le kèrè,il y jouait le rôle de frid,30,27
te ubiyɛn kafe lo kadi i ye ,tu préfères le thé ou le café,28,29
a ta yɔrɔ beyi suham ka sira ra,il est situé rue souham,31,23
sɛn zɛms ka siraba abi lembeye,route de lembeye saintjammes,30,28
o bi tlo kɛra n ka bon kan,on jase sur notre maison,26,24
a ye n ka ladili kan mɛn,suivez mes indications,24,22
aw be mulo yɛlɛla,qu’ouvrezvous ,17,14
ka wili ka bo yi tabali kan,se lever de table,27,17
bi ni sisan,aujourdhuimaintenant,11,20
wagati dɔra n bi facɛ sɛbɛ,j’écris souvent à mon père,26,26
kuruku ka minan bila yɔrɔ,du cidre de ferme,25,17
dugulasigi ye wɛnfɛldɛn,le cheflieu est weinfelden,23,26
fininkolo deni cɛɲumani,un lavelinge bruyant,23,20
tumabɛra a kan jan tumabɛra a kaɲ,plus cest loin mieux cest,33,25
ka ye a miriyaw la,de le voir dans ses pensées,18,27
ji ti anw fɛ,on manque deau,12,14
nisondiaya bi a kan,trésaillir de joie,19,18
i dɔgɔmuso ko ka di an ye,nous aimons ta sœur,25,19
balaw dɔ tun bi n kɔnɔna,un spectre m’attendait »,24,24
dɔnkɛ an bi na ɲɔngɔn ye yan,danse on verra bien,28,19
sɔdasi saba,trois des soldats,11,17
n bi tulu fɛnw dumu wagati damani,je mange souvent des pâtes,33,26
sanw bi tɛmɛna,des années passent,14,18
a tɔgɔ kɔrɔ ye caman,son nom signifie probité,20,24
a bi siran wa,il a peur la voix,13,17
n ka miriya ye ala ka cira deenw ye,c’est sûrement un prophète…,35,27
massa cɛ bi sinɔgɔla artaiɔn ye a fɔ,le roi dort dit dartagnan,36,25
bretɔnn ka kalan faw,des professeurs de breton,20,25
maseri angɛrvilɛr ka sira,rue de machery angervilliers,25,28
ntɔlenw,les tourterelles,7,16
andré de laeak ka sira mugan ni wɔɔrɔ,vingtsix rue andré de lohéac,37,28
lon kelen bi tɛmɛ,un million cinq cents,17,21
a ya kalen ka ta yɔgɔn wɛrɛ fɛ,il se jura de nen plus avoir,30,28
kulɛr juma lo ,cest quelle couleur ,14,20
n ba bɛɛ ta n yɛrɛ fɛ,je prends tout sur moi…,21,23
a kasa be bɔra,ça sent mauvais,14,15
dumunikɛbon,la salle à manger,11,17
pɔnba ka sira sanzera,allée du pont des arts changé,21,29
a ya ka mɔntru flɛ,regardant à sa montre,18,21
ohh ale fana ye dɔwɛrɛ ye,eh bien c’est particulier…,25,26
ɛri kelen ni klancɛ,une heure et demie,19,18
olugu mgɔw ko ka di o ye,eux ils aiment,24,14
martɛn dɔgɔcɛ bi gan a ra,martin petit prend le relais,25,28
kelen fɔlɔ a bi na n ka ko tɔw bɛɛ ɲagami,un… ça me gênerait davantage,41,28
an bi kalan kɛra,nous sommes en train de lire,16,28
o ya dabla wagati juma,et ils ont arrêté quand,22,23
kuru sara lo tun,cétait une vengeance,16,20
n ye ko kolon dɔ kɛ,jai commis une erreur,19,21
sigi ni ga kokɛtaw ye,ma vie dans laction,21,19
kuma man di ne ye,je suis plutôt timide,17,21
n ba darila an ka jigi,je vous en prie descendons,22,26
dusu dia ni ti se ka lakari,l’émotion fut indescriptible,27,29
ɛgɛn lanbɛr ka sira deen mugan ni duuru,vingtcinq rue eugène landais,39,28
aw yi n ka bataki sɔrɔwa,vous avez reçu ma lettre ,24,25
oumou bâ yi fé sorô,la mère ubu reçoit la régence,19,29
tuma dɔ revɛl kɛni le hakilitigi ye wa,revel est souvent défini comme un philosophe rationaliste,38,57
fa bi miniw ra o bi na se ko datugu ɔspi général la,les contrevenants pourront être internés à lhospice général,51,59
yoro ni gèrin tigè râ,le décor est à pans coupés,21,26
napoléon ka sodassi lo,ces vieux soldats de napoléon,22,29
a kan tcha,ce nest pas trop,10,16
o toumma lamè,elles ne l’avaient pas écouté,13,29
chichi écran lo,c’est un écran de fumée,15,23
kibaria djouma lo beyi,quoi de nouveau poteu ,22,22
a tina blassira,vous ne n’accompagnez pas …,15,27
a le sira jugu ni le bi taga bereni ka stade ra,impasse du stade périgny,47,24
a bina fêmê,même logique il est défendu,11,27
miriyata juman lo bi nin wolomani nin na,qu’en estil de ce critère,40,25
nin ye kanubaga fila ka dɔnkili le ye,c’est la chanson tendre et touchante de l’amante et de son amant,37,64
bokanegra seegi ra ka kɛ doz ye, boccanegra redevenu doge,31,25
o bonkɔnɔ minɛnw yɛrɛkɛ ni bɛ,le mobilier est dispersé,29,24
o hakili jigira a kun na nga wagati tun tɛmɛ na,il en eut lidée un peu tard,47,27
n dusu kasini bɛ fo ka dama tɛmɛ,jai fait une dépression,32,23
jurusiri yɔrɔw bɛ bilani le,des serrefiles se placèrent,27,27
o sira ba nin bi taga log la,route des loges cahagnes,28,24
a kɛnibɛ kom fo yi tun ma o sɔrɔ,ils ne parurent pas touchés,32,27
a ma na kɛ cogowcogo,coûte que coûte,20,15
gɔldsɔn ya ka p as sɔrɔ,goldston a obtenu son ph,23,24
a tagara kɔgɔji ra,il est parti en mer,18,19
n ye kuma kisɛ babaw nunuw kalan jonajona,j’ai lu les titres rapidement,41,29
sogo bina kɛ i fɛ wa,tu auras de la viande ,20,22
o tɔgɔ kɔni ban kun na,reste leur nom gravé,22,20
i lanino a ra ko bi na kanu wa,tu es sûr qu’elles aimeront,30,27
kalandenyɔrɔ wɛrɛ yɛlɛla tugun,un nouveau collège est fondé,30,28
a bi se ka mun lo sɔrɔ ka fɔ a ye,que peutil avoir à lui dire ,33,28
ni a ye n munumunu,s’il m’envoie promener ,18,23
i be elvire furu,tu épouses elvire,16,17
i ka vitri datugu,ferme ta vitre à la nuée,17,26
nin bɛ bina ɲanabɔ,tout cela va se stabiliser,18,26
yɔrɔ sumana,latmosphère se refroidit,11,24
sanpɛrɛn jigila damiɛn la tun,damiens fut foudroyé,29,20
bi lakol jan jorɛs,aujourd’hui école jean jaurès,18,29
ɲiningali sɔbɛ,une question importante,14,23
a kana siran,ne vous en faites pas ,12,22
a kaɲ ka famu,elle doit comprendre,13,20
kirɛyɔn wuleman lo bi n fɛ,jai un crayon rouge,26,19
a tun bɛn na joli lo ma,combien cétait ,23,15
o tagara na ye lɔndr,on l’emmena à londres,20,22
a tun bɔni lo a ma dɛ,il lui ressemblait,21,18
ma djama we lé,le décor est à pans coupés,14,26
a fo gnanan,on dira loffice des morts,11,25
fagari bi mɔgɔ maliya,la baffe ça humilie,21,19
e o ko ka gwɛlɛ dɛ,ah que c’est cocasse ,18,21
on tun ka ɲi ka yelen,cétait les dissoudre,21,20
nin yɔrɔ nin fankelen kari nin bɛ,le décor est à pans coupés,33,26
fɛta wɛrɛ beyi min ma sɔn nin fɛta ma,d’autres arguments plaident contre cet amendement,37,49
a bi tanni kɛ cɛmancɛ ra enosis neɔn paralimini ra,il occupe actuellement le poste de milieu à énosis néon paralímni,50,65
ka ta bi ma n bina toka i ka sɔrɔ a ɲɔgɔn fila lo di ma,a compter d’aujourd’hui je double tes gages,55,43
ko kunbaba tun yi yiri turu le ye,il est également lobjet de reboisement durable,33,46
nin hakili jagabɔ ni bi sira ɲuman kan idi bi na son a ma,cette proposition va dans le bon sens et le groupe udi la soutiendra,57,68
sɛbɛn sen kalan yɔrɔlo,la faculté des lettres,22,22
nin dugu deni faranibɛ limoge ka arɔnsiseman kan,le canton est entièrement inclus dans larrondissement de limoges,48,64
kumafɔ baga ɲalonnitɛ,le rapporteur est désavoué,21,26
ni fana ye fɛrɛ dɔ le ye,voilà du moins la théorie,24,25
breton yɛrɛyɛrɛ le yi nunu ye,de vrais bretons,29,16
fɛn min bi kungolo bana di mɔgɔma,voir syndrome cérébelleux,33,25
ko wɛtɛrɛ bé yi caruf ra,y a une promo à carrouf,24,23
miriya caman tun bi njereras la,enjolras était demeuré pensif,31,29
jybok yi hakili jagabɔ kɛ ko kɔrɔw kan,dubourg rappela des anecdotes anciennes,38,39
o yi duguni bɔsi o yi jɛni ni kɛ o yi benkaniw kɛ ka faratuguni o yi dugu denw ta ko bla jonmaya ma,la ville est prise pillée puis incendiée et la population est emmenée en esclavage,99,82
hakili sigi le ɲɔgɔn te yi,à défaut sagesse,26,16
tɔnɔ bi atelie ni na,latelier est très prolifique,20,28
ka ko yafô,d’écrire des épisodes,10,21
sassan sissan lo,actuellement l’article l,16,24
ale lo kɛni bɛ marais ka sira ye,il demeure rue des marais,32,25
anga djen ka dougawou kè anga dougou kolo yé,trinquons à la république,44,25
ni kalan fa tchièni toumbi yèlè la,ce petit précepteur riait,34,25
djabara ni kari la,le téléviseur est cassé,18,23
i dôgô mousso wqlima i kôrô mousso,tu aimerais ta sœur,34,19
yoro yan toug kadi,le temps était beau,18,19
murat ka sira tounta fè,murat lignorait aussi,23,21
ayi djigê miné folo,autrefois elle pêcha,19,20
moulo bi tchè râ do,questce qui lui arrive ,19,23
ayi kè wagati la,soyezy à lheure ,16,16
akili ynaman lo,ah c’est une bonne idée,15,23
mbi fèga weleni kè,j’aimerais téléphoner,18,21
a kooibi fèga kouma wa,veuxtu parler ditil,22,19
alouhou djon yé,qu’estce que vous êtes ,15,23
a kagni ka ta sissan,je dois y aller maintenant,20,26
ne lali bara ka toumbi na dia a yé,je suis sûr quil aurait aimé,34,28
mogô chi toun soumani tè tougiu,nul nétait plus discret,31,23
bina a welé,je vous appellerai,11,18
sigi na foyi teyi,il n’y a aucune autre chaise,17,28
yirô bè koumouni bè,tout à fait fatigué,19,19
aka so môgô dô lo wa,ce sont des parents à vous ,20,27
alou kanou ni bè,nous nous sommes aimés,16,22
sira tchama,rue cinqpères au numéro un,11,26
ayi djabara ni faga,éteignez le téléviseur,19,22
a tun ya kan kalan kɛ phidias ,il fut élève de phidias,30,23
ɲanamaw ani kuntanw ,les bons et les mauvais,20,23
a kèra kèlê kè kountigi yé,il reçoit la croix de guerre,26,28
iyi wôlon yé foka tèmè,ah que tu es curieuse …,22,23
nin ni tun bi alɛs ni ardwasi nin tugu ɲɔngɔ na,elle reliait alès à lardoise,47,28
i ta lo ye nin ye,cest celuilà le tien,17,20
a ɲa tigɛra sisan,elle est assez grande,17,21
abada,du tout du tout ,5,16
o ya kɛ ni indiyana ka bɔgɔnangwɛ le ye,elle est taillée en pierre calcaire de lindiana,39,47
a kaɲi teen muso,olympe ça suffit madame …,16,25
a lɔra tasuma kɔrɔ,il s’adosse à la cheminée,18,25
a diala ka tɛmɛ,il délirait de triomphe,15,23
sira biwɔrɔ rɛne palis,trois cents rue rené palix,22,26
a dusu jigira,avec une colère contenue,13,24
a taga cogo kaɲ,lascension est facile,15,21
loru sira zan dima,cinq rue jean dumas,18,19
h kadi yan kuluba ye,ian culbard est fan dh,20,22
an ka mɔgɔ minw sara ala bino sara,le ciel venge nos martyrs,34,25
premiyela anu tun bi jinɔgɔ nin siɲɛn la ni parɛ ye,nous pouvons voir les débuts des flaques deaux apparaître,51,57
a tagara kɔbelɛn fɛ lɔgɔra,en ce cas fitil combelaine sait lexistence de laurent et sa présence à paris,26,76
a fankelen tun lani lo fasial kan na ye kokolon kɛ a kan a ba dɛmɛ ka kɛ,il le supportait avec résignation et cela délivrait facial de la moitié de ses soucis,72,85
i be saba min ta ka taga dɔtɔrɔcɛ fɛ,onze rue du docteur valentin douze mille quatre cents saintaffrique,36,67
dimasi lonna ni kuran tigɛra adamadenw bɛ bo yɛrɛɲini,le dimanche étienne séchappa du coron dès la nuit tombée,53,56
gobele bila ni flɛ,pontcharrat voilà un verbe ,18,27
ɔrganisasiyɔn asosiyal o bɛ bi ta reniyɔn kɔ dugutigi fɛ,l’organisation a son siège social à san francisco,56,49
o tina muruti,ils ne se plaindront pas ,13,25
ala ka su hɛrɛ musomanninw,bonne nuit les filles,26,21
a bi n fɛ ɲanaman,elle maime beaucoup,17,19
a nana a yɛrɛ ma,elle est venue dellemême,16,24
a ya mɛ a,vous avez entendu ,9,18
o kun ba fɛ,elle a été aimée,11,16
ɔnhɔn ale le,oui c’est bien sur,12,18
o bina i ka balimamuso kanu,ils aimeront ta sœur,27,20
bɛ jera,tout le monde se tut,7,20
aw kɔrɔmuso duuru,leurs cinq sœurs,17,16
o kun ma lamɛn,ils ne lavaient pas écoutée,14,27
jigi ka bɔ kogo nin na jona,descend tout de suite du mur,27,28
bɛgɛn wɛrɛw,dautres animaux,11,15
teri jumanw la bina sɔrɔ,quels copains vatil avoir,24,25
anw bi min ,où sommesnous ,11,14
fɛn ɲuman le,cest une bonne chose,12,20
annu kɔrɔmuso kanu,on aimerait ta sœur,18,19
n bina nigɛjuru to ka da ma,je vais lui passer l’appareil,27,29
n binana tɛnɛlon,je viendrai lundi,16,17
mun na a ti ta ye,pourquoi n’y allezvous pas ,17,27
ni tun kɛra kɔnɔ ye,si tu étais un oiseau,19,21
n bi ni dɔgɔmuso fila ani dɔgɔcɛ kelen,j’ai deux sœurs et un frère,38,27
a ye dɔ fɔ,dites quelque chose,10,19
fen mi nunuw mandi ye tugu,les choses que je naime plus,26,28
a kana a lamɛn,ne l’écoutez pas,14,16
mɔgɔ mugan ni wolonfila,vingtsept personnes,23,19
ni le kɛra i ta ye,c’est celuilà le tien,18,21
n bi ni saan bisaba ni fila de ye,j’ai trentedeux ans,33,19
n nana aw ye,je suis venu vous voir,12,22
aw ye mu le ye,questce que vous êtes ,14,22
n be segi ka ji don a la,je remets de l’eau,24,18
dugula kan deen le,c’est un homme du pays,18,22
mu le a bi fɛ ka fɔ,que voulezvous dire ,19,20
a sɔngɔ man gwɛlɛ,cest pas trop cher,17,18
kɛnɛya i yɛrɛ ma,guéristoi toimême,16,17
matilde dusu tun diyara,mathilde fut bien heureuse,23,26
mɔgɔsi te yi,il n’y a personne,12,17
n be na kɔ sigi ka ta sisan,je vais y aller maintenant,27,26
mɔgɔw man ça,les gens sont peu nombreux,12,26
n bi se ka aw dɛmɛ wa,je peux vous aider ,21,19
jama yɛrɛkɛla,et la foule se dispersa,13,23
a bi na mule la tigɛ,qu’estce que vous ferez ,20,24
jon le ye yeelen tigɛ,qui a éteint la lumière ,21,24
sini n bina fani ko,demain je laverai le linge,19,26
san joli lo ba fɛ,quel âge atelle ,17,16
tile mugan ni wɔrɔ,le vingtsixième jour,18,20
a bolo bɔra ra,il s’en est tiré,14,16
dɛlfine a kaɲi,delphine cest bon,14,17
n ka teri le kun,c’était mon ami,16,15
a ka fisa,c’est assez bien,9,16
erik ka sigiɲɔgɔnmuso,la petite voisine deric,21,23
n yi mɔgɔw ye,jai vu des gens,13,15
ayi boli lalɔ,arrêtez de vous enfuir,13,22
a kɛra kamelenin ye nga a ka teli,il est jeune et il est rapide,33,29
a tun bi tulon kɛra na ye,elle jouait avec elle,25,21
a kaɲin ten,c’est bon comme ça ,11,19
a bagenbagaw ka kɛnɛ a,comment vont vos parents ,22,25
n bina ta sini,je men irai demain,14,18
ayiwa an hakili ba ra,ah je me rappelle …,21,19
i lanibara la bina diya i ya ,tu es sûr que tu aimeras,29,24
n bina a daminɛ,je vais commencer,15,17
i bina joli juru lo ta ,combien vastu emprunter,23,23
anw be se ka mun le fara,que pourraiton ajouter,24,22
n ta lɔn a bi min fɛ,je ne sais pas ce quil veut,20,27
a kana lamɛ,ne lécoutez pas ,11,16
ayiwa an ba lamɛn na,allezy nous vous écoutons,20,25
