dyu,fr,dyu_len,fr_len
ni bèyi galow,trenteneuf rue de banzeau quatrevingtcinq mille trois cent trente noirmoutierenlîle,13,83
a barla déni nan,saga consacrée à geralt de riv et ciri l’enfantsurprise,16,55
am bâ kédi,et je vous ai répondu que vous faisiez tout pour ça déclarait victorieusement madame josserand,10,94
a nana ka bô brésil mara la,il est revenu de breteuil aux premiers bruits,27,45
saint georges lo bi kouma nan,allée prieuré à saintgeorgesdesgroseillers,29,42
sira ni lo bi,route de sorède soixantesix six cent quatrevingtdix saintandré,13,62
luvrou bila ni de ta bali ko kan,le livre est sur la surface de la table,32,39
a bi sorô fana pays bas ani yoro wèrè,on en trouve aussi aux paysbas au luxembourg et en suisse,37,57
vénéréologie lo bi na ni djabi,la généalogie vient répondre à cette question,30,45
amérindien ka fanga lo,les forces amérindiennes sont commandées par tecumseh,22,53
muso man ni ye fan deen fila la ɲaga dɔ mon bi yiri sanfɛ,la femelle pond deux œufs dans un nid suspendu à une branche darbre,57,67
n lani noa ta ka tun ka da ye,je suis sûr quils aimèrent,29,26
a ka balɔntan kariɛri tɛmɛni kɔ a don na antrɛnɛri bara ra,après larrêt de sa carrière de joueur il se lance dans une carrière d’entraîneur,58,80
carhaix ka mogo gagne na,c’est le gars de carhaix qui a gagné,24,36
a tôgô lara ka boyan lassé kalan so bâ man,il est nommé en lhonneur de luniversité de hambourg,42,51
ayi kasdara soro,j’ai eu un accident,16,19
a toum bèna création ma,le résultat fut largement favorable à cette création,23,52
ne ka,la transparence est nécessaire nous nous y soumettons,5,53
a ka baara nin tun ka ca,son œuvre ensuite est abondante,24,31
o ka kɛlɛ kun ye tugu ni kanw ka klenya sira arime ra,il milite ensuite pour légalité linguistique dans larmée,53,56
nin kuma nin tɛmɛna sans kɛmɛ kɛmɛ tɛmɛ ninw kɔ,le débat a eu lieu dans les siècles derniers,47,44
a ti see na ti kɛ waritigi ye,il nen sera que plus riche,29,26
on dirɛ kɔrɔ bi nin bɛra,il paraît que tout cela est logique,24,35
a bi kanadiɛnw ka grupu mɛlmedia cɛma,elle appartient au groupe canadien bell media,37,45
latri ka cin wolonfila,sept rue de latrie,22,18
nɛnɛni bi kɛ fasugu saaba,la dégustation se décompose en trois étapes,25,43
a don na sanbru la,elle s’est retirée dans sa chambre,18,34
ma kissè foyi soro foro la,je ne trouve aucune graine dans ce champ,26,40
siran yan bi fanga kora a bi diugou bika sira kan,la crainte et lhorreur de la dictature conduisaient le pays tout droit à lanarchie,49,82
a bi balon tan komi kélè lo,il joue au poste de défenseur ou milieu de terrain avec léquipe de suède,27,72
i bina denn nani sôrôw,ils auront quatre enfants dont le géographe marc vernière mort accidentellement,22,79
o tununna yɔgɔ na san caman tɛmɛni kɔ tuman min na o bɔra munich,ils perdirent contact plusieurs années après que chacun quitte munich,64,69
plantin k tèmè sira bi sôrô paris,le passage plantin est situé dans le de paris,33,45
entrepris allemand lo,une autre entreprise allemande propose sur le même concept que le précédent lurinette pipilissi,21,95
aka yamogô bi yanfè,son chef lieu est emmendingen,19,29
tiuma dôrô a toum bâ fôra ka diussou kadi,d’autres fois il disait « elle est heureuse pour sa santé,41,58
oya la tôgô kan ko bertini,il est surnommé bertini,26,23
a boyè na yé yôrô saba,trois fois plus grand,22,21
min yi boɲɛnni na o ba wele janfa,ce qu’en termes polis on appelle… trompé ,33,41
o bi ka yira ko kongo woulou bi tchaya ra,c’est bien la preuve que le loup prolifère,41,42
nin ofisie ni bi dana a ka lɔni kɔsɔ,cet officier est dailleurs distingué par ses talens et ses connaissances étendues,36,81
tumadɔ masa bi talima walima mademazel mars wele kana dumini kɛ,il arrivait aussi quelquefois à lempereur de faire inviter à déjeuner talma ou mademoiselle mars,63,96
an bi se ka fèn bè minè ni col yé,on fait tenir pratiquement n’importe quoi avec de la super glu,33,62
i jak karol mɛtr apothicɛr le tun bin nin luni kɔnɔ,cette maison fut habitée par un certain isaac caron maitre apothicaire,51,70
a tun bi sɔkɔra o kan i na fɔ o bi sapelɛ fɔ cogo mina,il les récitait en boucle comme on dit son chapelet,54,51
nin bi la nin de kɔ,la vie demandait une préparation plus forte,19,43
o ka mè yélè mana,les maires des trois anciennes communes deviennent maires délégués,17,66
na sara a denn lo bina lô na gné,à sa mort son fils se chargera de défendre son projet,32,53
pressé ko tèadèle ma sé san ta ni konon ton man,ce n’est pas si pressé adèle n’a pas dixhuit ans,47,48
môgô kadi o yé,antoine watteau est probablement lartiste quils admirent le plus,14,64
oya fô chofèr ma kaka dow fara a sen kan,le conseiller demanda au chauffeur d’accélérer ce qu’il fit modérément,40,70
ne yanden tounti tan,je n’ai pas eu toujours les yeux éraillés et bordés d’écarlate,20,62
mɔnt pɛrmie o ye dugu le ye,montfermeil cest un pays,27,24
panie karayib jukɔ sira faran,rue du panier caraïbe ducos,29,27
kariyɛr den wolonfila min tugunibɛ ɲɔgɔnkɔ,sept carriera damont,42,20
sigi yɔrɔ ba fla,deux place lange,16,16
wagati dɔ ye ne ɲa muni,voilà une heure que je… yupp ,23,29
o cira nin be yi,ces commissions existent,16,24
aw yi livruw segi ka bila o cogoya kɔrɔ la,rangez les livres en ordre,42,26
tɛmɛ sira kɛra ni nowɛl yiri ye,le plancher est en sapin,31,24
fasiyɛl tun ya gwɛn,facial lavait congédiée,19,23
aw ka sɔrɔka jigɛ minɛ,pour que vous pêchiez,22,21
ebel kur sira,un route de sébécourt,13,21
a ka masaya ka kan ka kɛ san kelen le ye,son mandat est alors dun an,40,27
a ka di n ye ka weeleni kɛ,j’aimerais téléphoner,26,21
ɲɔgɔndan ni na nimuwazi nunu ka ataki ani o ka defanzi lo maɲi ka tɛmɛ bɛ ta kan,les nîmoises possèdent la plus mauvaise attaque du championnat et la mauvaise défense,80,85
a ɲakɔfɛta gwɛnibɛ,le revers est blanc,18,19
maxim sɔkɔra ka pan,maxime rebondit,19,15
bɛgɛ ba wɛrɛw nɛrɛmuguman,un autre grand animal jaune,25,27
a ka fari dɔɔni ni kafe ye,c’est un peu fort de café,26,25
n son tɔ kura polisiyara,quand j’étais jeune flic,24,24
a sigini lo a ka lu kɔnɔ,elle demeure dans sa maison,24,27
cɛni belebeleba,une très grosse bêtise,15,22
a ba yɛrɛ gwanna dondɔni,peu à peu elle séchauffa,24,24
ayiwa n ye a fɔ o ɲana,estce que je leur ai dit …,22,26
brande la peruyi ka foro,champs de brande la pérouille,24,29
krwazik ka batow ka jɔyɔrɔ,le port du croizic,26,18
brehat ka jamana deni,lîle de bréhat,21,14
ags ɲasinlebɛ saraw le ma,l’ags concerne les salaires,25,27
a ɲabɔra ow fɛ,pécuchet les convoita,14,21
minɛni saba bwasele kɔnɔ,trois impasse de la boisselée,24,29
ɔn sɔgɔlideni,tiens un petit crevé ,13,21
tan ni nani aveni de nɔrwis ,quatorze a avenue de northwich,28,30
kawusɛl tɛmɛsira feyitat ,passage du caroussel feytiat,25,28
alɛksi iɲas a epinal ka plasi,place alexis ignace à épinal,29,28
i bi bata la wa,avezvous un travail ,15,20
st o wagati min na,pendant ce temps le st,18,22
an ɲɛkɔrɔ a bi fɛ ka bɛn ɲɔgɔnma,cela nous paraîtrait cohérent,32,29
ka se ko sɔrɔ a ka gwɛlɛn,leur accès est très difficile,25,29
lu dɔw kɔnɔ,dans certaines maisons,11,22
saya kan ka,d’une voix mourante,11,19
ala ma kɛ a fɛ,dieu ne la pas voulu,14,20
ni dusu gwan muyuni ye,avec une colère contenue,22,24
ayiwa n ga se ka jigɛ minɛ,pour que je pêche,26,17
a sara seyilak mara la,il meurt le à seilhac,22,21
rɔme ka siko tun bi benna,le rêve de rome sécroulait,25,26
a laban ban na,ce dernier refuse,14,17
a ba famuna,vous comprenez ,11,15
eme o wele ka na,toi tu as été aimé,16,18
a tun ba lɔn na tun ba kanu,on sait sil ladorait,27,20
an bi no kè,nous agirons en trois temps,11,27
a tina yana bô,ça ne marche pas,14,16
aw yi bo na yé,emmenezle dehors,14,16
a yi mogô tchama welé,il a invité beaucoup de monde,21,29
mounane na la ni bè wa,comment je suis bête ,22,21
o ayi o ayi,oh aïe oh aïe ,11,14
orion yan,le visage d’orion,9,17
babose nenɲankɔrɔ nin ka figɛn,babochet ça me paraît léger ,30,28
wulu bo kɔ,le chien est avec eux,10,21
ne nale drɔn le tora,il n’y a plus qu’elle et moi,20,28
ne ne bi bakilar kanu,j’aime baculard moi ,21,20
na ma yannabo anbi na yigi,au pire on sera mouillés,26,24
oyé yongon kiunbè kokura koro,elle se rencontre vers kokura,29,29
kiuroussi mi ka bon ka tèmè,un pantalon trop grand,27,22
midi sera ka ban,il est bientôt midi…,16,20
dumuni wagati ra,à lheure du dîner,16,17
woulou de ni mugan,vingt et un petits chiens,18,25
a toun ti lara,il nen revenait pas,14,19
a tou bi tolo ké ra,il jouait avec lui,19,18
jon le ye lɛtri ni cii,qui a expédié cette lettre ,22,27
kana ban ora kaye,jamais ne renonce,17,17
tagara a mɛna,il est parti pour longtemps,13,27
bɔn martinɛ aviɲɔn ka sira,rue du bon martinet avignon,26,27
cɔmite ka sigiyɔrɔ ni kɛra jii ye,le siège du comté est jay,33,25
o bɔra ni bolo ɲuman ni fan fɛ ye,ils sortent de droite,33,21
mɔgɔminiw saara ka fɛti,la fête de la toussaint,23,23
nin bi yɛlɛ ko kɛ san,ça cest marrant,21,15
n ga i bi na minɛ a ka tle dama nin kɛ a,alors tu vas la congédier ,40,26
itan bi utiw dɛmɛna,liran soutient les houthis,19,26
a balora sable de sarti kan,il grandit à sablésursarthe,27,27
anri kɔni tɛ,non jamais henri,12,16
dɔt azia le ba ko filɛ ra,il est géré par dotasia,25,23
tewodɔr zan ka sira marvezol la,rue théodore jean à marvejols,31,29
mɛrkandiye diny lɛ bɛn ka sira,rue mercadier dignelesbains,30,27
a tagara lukɔnɔ,non il est rentré,15,17
ne koo a bi n gɛn na le wa,alors vous me chassez ,26,22
nin cogo kɛ wali nin do,qu’en estil de ce critère ,23,26
o ti yɛlɛ tabali kan,on ne grimpe pas sur la table,20,29
kalan kɛla bisaaba,une trentaine d’étudiants,18,25
nunu o kɔni diyara mɔgɔw ye,eux ils ont été aimé,27,20
augraben ka sira kembs la,voilà pour le vieux con,25,23
n dencɛ kalaw kɔnɔ,mon fils… dans les roseaux ,18,27
miseli nunu ka surun ka tɛmɛ filɛru nunu kan,les pédicelles sont plus courts que les fleurs,44,46
kɛn siitigi nin sera ka kuma mɔgɔjuguw fɛ,ken le survivant il savait parler aux méchants,41,46
filaburu nunu beyi kom n bi tripani,les feuilles sont composées bi ou tripennées,35,44
ɛsk nani kan lo wa,estce en quarte ,18,16
kɛnɛma jama tun bi wariko le ɲininga ra,dehors le peuple banquetait,39,27
béringier ka sira nimɔrɔ wolonwula,rue béringier au numéro sept,34,28
moun kouma yèrê lo bi fora,de quoi estil question ,26,23
dɛmdeni ka ji kɛrɛfɛ yɔrɔ,lot cote plage dembéni,25,22
puɛrto lunbrera ka sira mabli,rue puerto lumbreras mably,29,26
sira saba ye yelen ye,trois rue flamande,21,18
cɛncɛn figɛmani,les sablés légers,15,17
sabu nne bi na bila yan,pourtant et j’en finirai là,23,27
o ye labe cɛ ye,monsieur labbé,15,14
n ka valazi tununa,ma valise sest perdue,18,21
i bi yɛrɛbɔra cogo juma,comment t’en tirestu ,23,21
ly limiɛr ka sira yeleen,rue louis lumiére signes,24,24
nin ko ni ma labɔ,mais cela ne le satisfait pas,17,29
sistɛme nun bi ,chaque soussystème interagit avec les autres soussystèmes,15,57
zan lafɔre siraba mugan ni kelen,vingt et un boulevard jean lafaure,32,34
a bi jinafilɛta caman kɛla farafina jamana la,elle produit de nombreux paysages et scènes africaines,45,54
a jigira ka bɔ sanfɛ yɔrɔ la e a nana kuma ni kititigɛbaga ye,il descend de lestrade et sexplique avec le jury,61,48
an ma se ka to yi an ɲagamina o ta,il ne put y rester sétant brouillé avec le précepteur,34,53
a bi toulon filanan kɛrɛ komi dɔni,il joue le deuxième test qui suit de peu le premier,34,51
tagama ka kruwa bisi la tomi kɛmɛ ni bisaba ni wolonfila,chemin de la croix de bissy au numéro cent trentesept,56,53
a kɛra kitilatigɛbaga ye,licencié en droit il exerce la profession davocat puis davoué,24,61
kɔrɔti min kaɲ ka bila kan maɲi ten,cet amendement n’a donc pas lieu d’être,35,39
oreli miriya tara a ka diɲɛlatigɛla fɛn baw kama,sous le tissu la vie daurélie frissonnerait dattendre lélan suprême dû à leur longue passion,48,92
i bi maledɔrsi sis ka marfakan mɛn na wa ,entendezvous les canons de maillardoz et de ses suisses,41,55
a ya di o bɛɛ ma,diffuser à tous,16,15
laburs ka sira a gɛntile ,rue labourse à gentilly,25,23
jideni yɛlɛma na ka kɛ jiba ye,la chute deau gelée en hiver,30,28
henri dès ka sira wɔɔrɔ,six rue henri dès,23,17
masacɛ ka faman,monseigneur l’évêque,15,20
nka sofaw ye fɛn bɛ,mais la cavalerie fit tout,19,26
a bina ta ka bɔ o ka dugu ka layɔrɔ ra,il quittera son ambassade,38,25
kibariya dɔ ya farifaga,un courant lanime,23,17
blood lava ka sira,rue de bootz laval,18,18
diogɛn bɛrtran ka sira seegi nan,huit avenue diogène bertrand,32,28
yɔrɔ saba ye tulon kɛ yɔrɔ lamini,trois niveaux de rangées de sièges entourent le terrain de jeu,33,62
a ya bilasira sɛn omɛr ka kan na ani arme ba yɔrɔ la,il laccompagne au camp de saintomer puis à la grande armée,52,58
liam lɛnch le yi klip nin turne,le clip a été tourné par liam lynch,31,35
potie ka sira tan nan,rue potier au numéro dix,21,24
mugan ale ni livru kelen,vingt et un livres,24,18
ne ye be diplom sɔrɔ,je suis diplomé de be,20,21
ekɔli ale nin kolɛgi bo ka dugu kɔnɔ,une école et un collège sont présents sur le territoire communal,36,64
kosoto urugi ka sira mɛndo kɔnɔ,route du causse dauge mende,31,27
aridɛsi,abbesse,7,7
mobili sira bɛrtɛnkur,rue de bus bertincourt,21,22
ko sɔbɛ le,c’est très important,10,20
a balora pɔr kokilam la,il grandit à port coquitlam,23,27
loze sahaŋ ka sira,route des loges cahagnes,18,24
o bɛ bi bɔra gubeta le tora,tous sortent excepté gubetta,27,28
a be tara kɛnpe,il va à quimper,15,15
li moges lo,rue alain grafeuil à limoges,11,28
yôrô beyi wa,il y a des places vacantes ,12,27
ka se ka yé,rue daube à magnicourt,11,22
ika bara yoro,chemin de travaux nohic,13,23
sira tan ni segii,rue thieux au numéro dixhuit,17,28
sira saba,trois rue dagnan bouveret,9,25
pierre lé yi fama yé,on nomma pierre leroux,20,22
dondɔni den bi segira lukɔnɔ kowra a ni o ka dugu kow ra,peu à peu lenfant sinitie aux lois et aux pratiques de la communauté,56,68
nunu diɲɛ modɛl nunu bi ɲɔgɔn sɔrɔ turkmenistan na ale ni azɛrbajan na,les espèces de ce genre se rencontrent au turkménistan et en azerbaïdjan,70,72
o sɔn na maruze la,pourtant maruge très motivé parvient à se faire accepter,18,56
kɔrɔya caman mun tɔnɔ lo bo la,lâge dor ça sert à quoi,30,23
froidefɔntɛn ni ka siraba den tan ni naani,quatorze rue de froidefontaine,42,30
montardon ka tèmè yoro,avenue de montardon à pau,22,25
gayral ka sira,rue jean gayral toulouse,14,24
hasting ka sira lo,vingt rue dhastings,18,19
charle ka sira tan ni nani,quatorze rue charles emeringer,26,30
mahabou ka sira,rue de mahabou mamoudzou,15,24
malzizu ka gnoro,neuf avenue du malzieu,16,22
ah matigi barka,que dieu soit bénit ,15,20
a sara ka fon,à moitié vivant,13,15
faama ou kodi tougou,que propose le gouvernement,20,27
eh o yèna,non eh bien alors ,9,18
jon le bi sɔnka la ara,qui croirastu ,22,14
ɔhɔ mɛ mun kama,oui mais dans quel but ,15,23
ale dencɛ nin ne le,ce fils c’est moi,19,17
marsɛl bzlo olivɛt ka sira,rue marcel belot olivet,26,23
ah san tɛmɛ ni ɲɔgɔn,ah comme l’an dernier…,20,22
mɔgɔ jugu ka boyi,a bas les traîtres,17,18
ki bi fɛ ka jumɛ le ta,lesquels veuxtu prendre ,22,24
olugu a diara o ye,elles elles ont aimé,18,20
i ka jana filimu yi juma le ye,quel est votre film préféré ,30,28
n bi se kana nin teri ya,je peux venir avec mon ami ,24,27
a ka sira la,dans sa direction,12,17
oka fourou sara,cet engagement fut annulé lorsque sa sœur marie épousa jean de montfort autre prétendant,15,88
maroc lo koni bi kèra,cellesci contiennent également des insectes du maroc des îles canaries et de madère,21,83
aba fôra ka bi na yèlè ma,je dois vous avouer que nous sommes gênés par cette dérogation,25,62
san nounou tougou râ yingon kô,les années qui suivirent ladislas et ses frères collaborèrent efficacement avec le roi salomon,30,94
sɔrɔni bi na di mɔgɔ min bina sɔrɔ,prime à qui le trouve,34,21
a bi nunu kuma nunu kɛ foo donkili nunuw ban tumana,parler ainsi ad libitum jusquà la fin du morceau,51,48
a ko tun diara ob ka departeman mɔgɔw ye,elle était la plus importante du département de laube,40,53
a ka fakɛ dɔ zakaro min kɛra avoka ye lo ba balo ra,son parrain lavocat zakharov se charge alors de lélever,51,55
an dencɛ robɛr boɲɛ min kaɲi ka se i ma ka fara minuw bɛ bina guwan e kunna,ils te doivent obéissance cher fils robert ainsi qu’à tes successeurs,75,69
o yi ɲɔngɔn kunbɛn funjan mara ra zejan kɔnɔ ale ni anwi kɔnɔ,elle se rencontre dans les provinces du fujian du zhejiang et de lanhui,61,71
lafargue prada,rue rené lafargue prayssac,14,26
banija lika sosiyete piblik do min bi baraka kɛ kuranbon kɔnɔ viskoza d00 kɔnɔ,banja luka une société publique travaillant dans le domaine de lélectricité viskoza doo,78,87
muso saba minuw diara a ye kɔsɔbɛ,il aima de toute sa gloire les trois femmes complices pour le chérir,33,68
mɔgɔya min bi sili ani brezil kan be senkan ale bi,la coopération entre le chili et le brésil continue par la suite,50,64
jon lo yo ko fɔ o ye korigane ,qui donc les a avertis la korigane,30,34
alé fè o ka kèwali kèra ka sin a ma,elle se sent aujourd’hui ciblée,35,31
sayaa jatigɛ le don na n na,une inquiétude mortelle m’envahit,27,34
nin ko nin le kaɲi ka bila sen kan,il serait logique de mettre en place ce dispositif,34,50
a ka dɔgɔcɛ alɛks fana kɛra jurupan la le ye a bi tubabujama mara fɛ,son frère alex est aussi un sauteur à ski de niveau international,68,65
zapan yuzen ka award nin kɔnɔ a yi sɔrɔli sɔrɔ min ba yira a ka mɔgɔyasɔrɔ ye,elle remporte le prix du meilleur espoir au japan yusen award,77,61
gradi min ye a bi welee sɛrijan a yo sɔrɔ,il obtient le grade de sergent,41,30
ka mɔgɔw filakɛ ka ekɔli ka fara wari ekɔli ani bɛgɛnw filakɛyɔrɔ lo bina na lɔ,mais seules les écoles de santé et les écoles déconomie rurale vétérinaire seront créées,79,88
paseru ka sira flery an biyɛr kɔnɔ,rue passeroux fleuryenbière,34,27
n ga a ye dencɛ ni bila ale ni alimɛti fariman dɔ ye,cependant elle confie le garçon avec une amulette sacrée,52,56
nin dugu nin ka sɔn filanan le ye ka tulon min o ba wele ko paralɛnpik divɛr nin kɛ,il sagit de la deuxième participation de ce pays aux jeux paralympiques dhiver,83,78
egliz nin lɔra zɔrz de lida tɔgɔra le,léglise est dédiée à georges de lydda,37,37
artir tun banna mɛ a labanna a nana kuma marta fɛ,arthur refuse mais à la dernière minute parle en privé à martha,49,63
jean pierre pommier lo kèra gnamôgô yé,létablissement est actuellement dirigé par jeanpierre pommier,38,61
ka bara kè ka low,cela permet une grande souplesse d’utilisation,17,46
a doussou sago kèrè,article trois de ses dernières volontés,19,39
obi na mè ka sôrô ka yé,il faut attendre deux siècles pour le voir accepté à rome,23,57
a bi informations dira kodjouhou,flaherty lui communique ses renseignements par émetteur sat com,32,63
linkhout a ni mzldert,lummen linkhout et meldert,21,26
bescia province lo,il est basé à carpenedolo dans la province de brescia en lombardie,18,66
a chocô râ a kan,repritelle brusquement après un nuage qui finit de traverser ses yeux clairs,16,76
foyi le ti se ka ɲɛ,hélas rien n’est parfait,19,25
sanpɛl ka sira la sela la,rue de champel au cheylard,25,26
mɔgɔ miniw yi bugɔ yi caaman sɔrɔ,les gens les plus frappés,33,25
o diara aw ye wa,ça vous a plu ici ,16,18
n ka diana muso giklefɔr,giclefort — oui ma chérie,24,25
aw sigɛna le sa,êtesvous fatigué ,15,17
mɔfzran a tun bi kuma mɛna ni tlo kelen ye a yɛlɛmana mɔdɛl sɔra,monferrand qui écoutait dune oreille se tourna soudain,64,54
mesie simit kɛra amerikɛn ye wa,monsieur smith est américain ,31,29
pɔl rie ka sira seegi fan fɛ,huit allée paul rué,28,19
fɛn bɛ bi sɔrɔ pari kɔnɔ,car paris est un total,24,22
an bi na sekɔ ka bara ni kɛ,on refait le rapport,27,20
a seba ale le ye,il dépend de l,16,14
roz tun bi fɛ ka a famuya,rose voulant avoir compris,25,26
tɛn tɛn tɛn patɛn pa,tin tin tinpour pantin,20,22
a ye min sera teriyama,voilà qui vaut amitié,22,21
n sara ka fɔn,à moitié vivant,13,15
a ma welenikɛ abada,il n’appela point,19,17
sini o bi na jigɛ minɛ,demain ils pêcheront,22,20
la fani sangololaman,surtout et gilet drap bleu,20,26
ɛgɛni hatɔnani pari,square eugène hatton paris,19,26
alfrɛd sɔngɛr ka sira mɛdiyɛr,rue alfred songeur maidières,29,28
dɛrkur ka sira tur an vime ra,rue dercourt à toursenvimeu,29,27
a kɔrɔ le ko ka vɛn kɛ,cestàdire faire du vin,22,22
o bi yɛlɛ mɔgɔwra,les trégorois sont moqueurs,17,27
ainat nunu ka sira,chemin des aynats bouloc,18,24
an kɔni ka douane tun ye tiɲɛ ye,je suis sûr qu’on aimait,32,24
jean ka sira tan ni seegi,dixhuit rue jean de la barre,25,28
a tun kɛra gore ka mɔn pɛri ba ye,il fut curé de gorée,33,20
o kɔni ɲɛna,cest assez bien,11,15
a farala amiɛn kan,il rejoint ensuite amiens,18,25
o cɛjugu lama ne,elles sont myrmécophiles,16,24
o ya kè ni nigè yeé,le toit est en zinc,19,19
ma famougna,le au maire est guy atlan,11,25
dougou tigi,la république dominicaine,11,25
o yè na dè,non eh bien alors ,10,18
fraskati sira la mɔntaŋak kɔnɔ,rue frascati montagnac,30,22
sɛn bartelemi ka sira kahɔrsi kɔnɔ,rue saintbarthelémy à cahors,34,28
tanɛruw ka sira saru kɔnɔ,rue des tanneurs à charroux,25,27
a ma kɛ makoya ɲɛnbagakɛ ye,il est superflu et inutile,27,26
deliniya ko ta ra,il n’y a pas d’expérimentation,17,30
a baa ane silivan ka fara jɔn ka,sa mère ann sullivan et john,32,28
mɔn alarik ka sira narbɔne kɔnɔ,rue du mont alaric à narbonne,31,29
rene renol ka sira bisleyi kɔnɔ,rue rené renault à buchelay,31,27
tayipie ka sira parteneyi kɔnɔ,rue taillepied à parthenay,30,26
a ye nɛnɛkiriba kɛ,elle imite un gros soupir,18,25
kokɛrɛt ɲamɔgɔden nin,cet imbécile de coqueret ,21,25
ko kura jumɛ lo be yi,quoi de neuf ,21,13
e o tɛ,ce n’est pas le cas malheureusement,6,35
aw ɛ kɛto o si tanw fɛ,excuseznous nous nen avons aucun,22,32
a bi fantan tasumaw kɛra,il fait des feux de pauvre,24,26
sigi yɔrɔ nin bi sɔrɔ viɛn,le siège se trouve à vienne,26,27
tabali baba fla,deux grandes tables,15,19
a cɛkaɲ kojugu,cest trop beau,14,14
o dun ɲinana n kɔ,nous étions oubliés,17,19
teodɔr botrɛl ka sira perɛn kɔnɔ,rue théodore botrel plérin,32,26
guiché wou ka sira,rue des guichets sées,18,21
a ta sou man mène yoro gêni bê,le phare est peint blanc,30,24
blazey lo,blanzey à fougerolles,9,21
bressole ka sira da fanfè,avenue de bressolles à domérat,25,30
valrose ka sira fanfè,avenue de valrose borgo,21,23
forfert ka sira fila,deux rue forfert,20,16
toubabou wolo ra,les cromags étaient nés,16,23
dofine ka sira ɔrleyan,avenue dauphine orléans,22,23
alezan fana bi sɔrɔ,on trouve aussi de lalezan,19,26
o ɲɛna kɔsɔbɛ,c’est bien cela,13,15
ekiri fanfɛ,un chemin de lecurie,11,20
o bi mɔgɔ nusɔndia,ceci fait horreur,18,17
bulan ka sira albɛr,rue de boulan albert,19,20
kebɛk la kanal ka so mɔgɔw ra,au québec sur canal famille,29,27
mɔgɔdulonyɔrɔ binkulɛri kursayi ra,le crucifix vert à courçay,34,26
a bi yera ko nɔgɔya be yi,je vois qu’il y a du mieux,25,26
so kɔnɔna nin tun kɔrɔta ni lo,la chambre était haute,30,22
bɛgɛw ka lɔgɔ,marché aux bestiaux,13,19
bɔskɛ ka sira sans fɛn sigɛn kɔnɔ,avenue du bosquet mougins,33,25
nunu ko bi se ka farakan,ceuxci peuvent être divers,24,26
stella ka kuma cogoya naani,quatre expression de stella,27,27
zan tingeli ka sirada fanfɛ evre kan,allée jean tinguely évreux,36,26
madrid ka sira tan ni fla fan fɛ,douze allée de madrid,32,21
mɔgɔ min bi mɔgɔ laban ni ɲafɛ,l’avantdernier,30,14
a kokadi ɲɔgɔn ye dɛ,vous vous aimez,20,15
ehe mesie de koson aw ni cee,et… merci monsieur de courson,28,29
an bi sesil kan mɛna a bi donkili lara jardɛn na,on entend chanter cécile dans le jardin,48,39
an tun bi tagara min le ,où allionsnous ,24,15
wuluni ba labon kɔnɔ,le chien est dans sa niche,20,26
pigmal ka sira saaba,trois rue du puigmal,20,20
n ka kuma ni ma seka dia mɔgɔw ye,j’émets un avis défavorable,33,27
elan van jii kɛra mɔgɔ saaba nan ye,ellen van dijk est troisième,35,28
repiblik dominikɛn,la république dominicaine,18,25
jɔrd ka sira robiɔn kɔnɔ,route de gordes à robion,24,24
lase fan fɛ moliɛr la,avenue de larché à molières,21,27
an ka quand kuraw ye,voilà nos nouveaux chouans,20,26
mɔnmark ka sira mɔnki kɔnɔ,rue de montmartre montcuq,26,25
antoin vasɛr ka sira mugan ni kelen,vingt et un rue antoine vacher,35,30
a bi bon ba ni gɛnrɛn nan fan fɛ le,il est situé au bout de la grande cour,35,38
sini a bi na taga jigɛ minɛ,demain elle pêchera,27,19
an tu bi bolo yɔrɔ ni makamaka la,on se troussait les manches,33,27
o bi nana wa,ils seraient venus ,12,19
kɔlɔn berto ka sira kelen,un rue du puits berthaud,25,24
fegi sira limur,rue fegui limours,15,17
sira nicola gogol rɛns kɔnɔ,rue nicolas gogol à reims,27,25
o bi yɛlɛ bila san,cest marrant ça,18,15
o kɔni bi na dia ye,je suis sûr quelle aimerait,19,27
sira juma fanfɛ,quelle est la logique,15,21
ka dɛmɛni kɛ,servir sans subir,12,17
o bi maxim gɛna,maxime est poursuivi,15,20
moravɛr le tun ba balora,mauravert le nourrissait,24,24
kabakuru magamani,de la pierre meulière ,17,22
