dyu,fr,dyu_len,fr_len
a ni sisinla ka ayeropɔri ka ɛntɛrnational yɔrɔla,elle est basée à laéroport international de chişinău,49,52
done nunu bi se ka sɛbɛ abi se ka jɔsi a bi se ka sɛbɛ tuguni,les données peuvent ainsi être écrites effacées et réécrites,61,60
a lasa n be n ka lon ta,annule je prends ma journée,23,27
genɛt kare mugan ni duruna b,vingtsix b rue de la genêtre,28,28
i ye sɔnnɛri kari naani,un rue de la caramagne onze zéro zéro zéro à carcassonne,23,56
albɛr ya jabi ko ale le,prier la vierge marie,23,21
cos dɔg men ka sira,route du causse dauge mende,19,27
lavradi bi na ka kunandia sɔrɔ,lavradi aura sa grâce,30,21
patati kɛmɛ ni biduuru ni wolonfilanan bi tagamana o cogoyasi ɲanama fana kan,l’amendement numéro cent cinquantesept tend également à favoriser cette solution amiable,77,88
peisonɛl kare naani,quatre rue peyssonnel,19,21
bobo cité kobawoé,cité montjean à fresnes,17,23
a bi mounou mounou na jura kôrô,il skia dans le jura,31,20
sɛzi wɛrɛ beyi tuguni,il n’y a aucune autre chaise,21,28
garduw ka sira tan ni filanan,rue des gards au numéro douze,29,29
munna a bi tagara,pourquoi y êtesvous allé ,17,25
a cira ka taga mediterane na,il est envoyé en méditerranée,28,29
rɔnde bɛs ka sirasaba,trois chemin de la ronde besse,21,30
sɛktius lu mugan ni duuru,vingtcinq cours sextius,25,23
pasteur bolo la,la liturgie comporte en général une bénédiction par imposition des mains du pasteur,15,83
clement sira dourou,cinq route des petits cléments quatrevingtquatre quatre cents villars,19,69
ale tɛ,ce n’est pas le cas,6,19
kastel jalu,rue jean duthil à casteljaloux,11,30
finɛtri ye bɔyɔrɔra ye cogo yasimna pɔn fana ye o cogo le ye,de même que la fenêtre est une évasion que le pont est un lien,60,62
komarɛs ka sira waabinaani ni kɛmɛ saaba ni biwɔrɔ tin,route de pomarez quarante mille trois cent soixante tilh,54,56
saama bisaaba ni saaba,trentetrois éléphants,22,21
onhon cɛ n bina filɛ,alors monsieur… je vais voir,20,28
fransiskan mɔnikɛ seginna ka na talɔn filɛ,un moine franciscain revient voir un talon,42,42
a ti kuma cama sanbrula ni sɛnɛ ni duani kuma tɛ,il intervient peu à la chambre essentiellement sur les questions agricoles et douanières,48,88
n ti fɛ ka tagama joona,je ne veux pas marcher vite,23,27
o mɔgɔ wolofila le lɔɔ yɔrɔla,elles sont sept sur les rangs,29,29
a be taara so kan,elle va à cheval,17,16
nale lo an sɔn na ma,dans ce cas avis favorable,20,26
a ka to wagati la,soyezy à l’heure ,17,17
an ka ben kelé man ka kè yongon fè,il se disait dâme tendre et aimait les fleurs,34,45
nin tablo ni kɔfɛ a ye bara min bɛɛ kɛ kɛra gudo le ye,à part ces tableaux son œuvre peinte ou dessinée est restée assez confidentielle,54,80
an yan yɛrɛsɔrɔ ni seegi gansan ye,et on se retrouve avec un panier sans fraise,34,44
a fatɔyala ka toga kolokolo komi fatɔ,elle délire et rampe comme un serpent,37,37
dugu fur ka sira fila,deux rue du four de la nation,21,29
sisan a fagala,il est désormais éteint,14,23
a yi a kaɲi,voilà qui est bien ,11,19
anu bi kalan na,nous nous lisions,15,17
tan ni wolonfila uti tle,dixsept août le soleil,24,22
antoini vase ka sira mugan ni kelen,vingt et un rue antoine vacher,35,30
jacques lui ka kananen lo,louisandrégabriel bouchet est un élève de jacqueslouis david,25,60
a fèrè la aka fanga touma nan,omer savourait pieusement lheure de son pouvoir,29,47
pp den kèmè il a ni bi sa ba,et deux cent soixantetrois pp,28,29
allemand do kili la la lo,il est un musicien et acteur allemand,25,37
sira wou ika pa kolon,les voici tes faux cols ,21,24
a koumba yèrè kèra mogo youma yé,gbôklé est actuellement divisée en deux départements fresco et sassandra,32,72
mɔgɔ mugan ɲɔgɔn tulonkɛla,une vingtaine de joueurs,26,24
menuye ka sira mugan ni duuru kɛmɛsaba ni mugan semodɛn ,chemin du menuey vingtcinq trois cent vingt chemaudin,56,53
fɛrnande ani zozefine ka jukɔrɔla,bas à fernande et à joséphine,33,29
kun sɛk ka sira angulɛm la,rue du pont sec à angoulême,26,27
segi a kan kou dayi,répétezle lui sans trêve,19,24
faubourg saba de crux,trois faubourg de crux,21,22
kouma ko gèlé tara,mais il ny a pas de règle,18,25
wouou mousso den nabi,quatre chiennes,21,15
emile kɔm somɔ,émile combes chaumont,14,21
sirawili niseya,rue poussière à nicey,15,21
klo mari arle ka sira,rue du clos marie arles,21,23
o bi yala la ni jagwɛlɛya ye,ils se promirent intrépides,28,27
polidɔr barbeyi ka sira ka bɔ mazamɛt,rue polydore barbey à mazamet,37,29
a ye brivɛn denmisɛnw ka sira minɛ,seize allée des petits brivins,34,30
teodɔr botrɛl plerɛn ka sira,rue théodore botrel plérin,28,26
kɛrsugɛt ludeyak ka sira,rue de kersuguet loudéac,24,24
lɔsi ka sira min be yi sɛr,rue de lauche à serres,26,22
gran bretaŋ lo,le grandebretagne,14,17
gistave dicɛne ka sira min be dred,rue gustave duchesne à dreux,34,28
brokar ka firiya muso,madame veuve du brocard,21,23
a ka tagamasɛn tun ye lolo ye,son emblème était une étoile,29,28
damiɛn tun ya yɛrɛ majigi,damiens se calma ajourna,25,24
kasi tu ba yɛrɛyɛrɛla,les sanglots la secouaient,21,26
birɛnsilal ka sira,rue de la bretenière à authume,18,30
n te i kɛ cogo fosi fɛ,je ne veux point dart,22,21
sirɔn for ka sira,route du chiron fors,17,20
kan wililen majigini,haut d’un ton soumis,20,20
a fara,cour des automates à nantes,6,27
a yɛrɛman bɛ kununa,tout son être ressuscita,19,24
bisou jɛgɛra a sen filanan la,melchior sinclina derechef,29,26
ibi bamuso dama,mère ubu à part,15,15
n bina dumuni kɛ,je vais m’embourguignonner,16,26
mahɛde sɛkɔla ka la,et la maheude se rendormit,19,26
wagati tan ni wolofila tuma,le dixseptième siècle,27,21
kelen tubabu jamana na,commun dans toute leurope,22,25
blasie ka sira tan ni fila,douze rue des blassiers,26,23
a le ya lamaloya,et ce lhumilia,16,14
a sera ka a yɛrɛ gosi,il sen est tiré,21,15
juruɲɛfɛ ban bé yi,devant le filet un banc,18,23
si râ bâ wolo fila,six rue moulin neuf,18,19
bɛgɛw dɔ,dautres animaux jaunes,8,22
espagnol ma nâ,l’espagnol n’a pas bu,14,21
alu alu lite,vous vous lûtes,12,15
kelen pasimɛr tan ni fila kɔnɔntɔn,un pachymère douze neuf,34,23
jean ka sira lo,ptolémée la place en galatie,15,28
janvie amir ka sira,rue janvier amiens,19,18
danpon kɔlmɛn ka sira,rue de dampont colmen,21,21
raflɛt ka sira naani tɛmɛ bali,quatre impasse de raffet,30,24
a bɔni lo dɔktora ma,il obitent un phd,20,17
lɛs oz ka sira tɛmbali,impasse léche eauze,22,19
n la ni bɛra o ba fɛ,je suis sûr qu’elles aiment,20,27
aw kana faratilendo foyi ta,ne prenez aucun risque,27,22
gugɔl bi tiɲɛn na ka taga,google moisit en plein air,25,26
gut mɔrt ka sira wɔrɔ,six rue de la goutte morte,21,26
o ya kan tigɛ,il fut guillotiné,13,17
piblisite bo gwɛrɛ la,la publicité les rapproche,21,26
kerawotrɛd lo,cest keraotred,13,14
aka dougou bâ kèra pologne,son cheflieu est cologne,26,24
a bi na gnè,floraison de juillet à aout,11,27
lucie ka sira mougan ni wolonfila,vingtsept rue lucieaubrac,33,25
salmon,vingtsix rue albert salmon,6,26
elé bi toulo kèra ni sanou yé,la coquille saintjacques,29,24
marque bissa bâ,trente marque debat,15,19
diusdou koun bi sôgô sôgô,le moteur tousse en crachant,25,28
a lelé toulbé kélè ni sanfè,dominant le combat au début bryan sera finalement éliminé par jin,27,65
aba bolo wili,levez le doigt ,13,15
grenelle ka sira bâparis,boulevard de grenelle à paris,24,29
sira tèmè ni teyi gazon,deux impasse du gazon,23,21
babiz ka sira,rue de la bise la bâtieneuve,13,28
ibi ni le kèra wa,tu fais du snowboard,17,20
rue mort ka sira,rue dervillers mory,16,19
bi yi hati lo le yé,aujourdhui cest dimanche,19,24
ah ni tama,merci de vous être déplacée,10,27
ne kissè kouma lo fora a yé,je vous parle des cartouches,27,28
yo bila ka ta kana,je les fais venir d’alsace,18,26
talence ka sira,rue bahus à talence,15,19
i lali mo a râ wa,et je vous crois,17,16
an toumbi sera plato yoro la,on approchait du plateau,28,24
fle mousso margas,oh la veuve marcasse …,17,22
alençon sira,rue demées à alençon,12,20
bi wagati kalan na,je lis le times,18,15
a ye a kasamɛ yɔrɔ jan,il le renifle de loin,22,21
an ka kɛwale ɲumanw kɛra yee feen ye,nos atouts sont bien réels,36,26
a ou i doumouni kè wa,vous avez mangé ensemble ,21,25
gig ko kôrô lo,cest un concept légal ancien,14,28
a tɔgɔ bɔɔnibɛ sarl lemɔn ma tugabu kelen min tun lɔnbɛ mɔntreal,son nom fait référence à charles le moyne lun des colons marquants de montréal,64,78
sɛtrɔlɛr wolola kalama kɔnɔ misigan kɔnɔ,seth troxler est né à kalamazoo dans le michigan,40,48
dini natal ka sɛnɛ minisiri ani defans,deane ministre de lagriculture et de la défense de la colonie du natal,38,70
ɔnɔn a fara,non tu es capitonné ,11,20
o ka ka kɔni ka nana ye,d’abord on dit apporter…,23,24
cɛjan banabagatɔ jɔra kelen kan,conclut lescogriffe blême,31,25
a bi nɛnɛkiri yan le,cest là quil repose,20,19
o bɛ bi fɛn kelen le yala la,il vise le même objectif,28,24
n bi fɛ o ka taga,j’en demande donc le retrait,17,28
cɛncɛn leɔn bɛrnar ,sand par léon bernard,19,21
o bi bɔ ardɛn le,il vient des ardennes,16,21
kravate gwiliman den fila san,acheter deux cravates solides,29,29
n tun ti sonɛr mankan mɛn na,je nentendais pas la cloche,28,27
bɛtranz ka sira ravo ,route des bertranges raveau,21,27
nin ti livru ye,ceci nest pas un livre,15,22
bovil ka siraba amiyɛn ,boulevard de beauvillé amiens,23,29
n tlo bi tama kan na sanfɛ,j’entends marcher làhaut…,26,25
saman finman den mugan ni fla,vingtdeux éléphants noirs,29,25
león bernard ka bissé,sand par léon bernard,21,21
an yi fanou dja,on met le linge à sécher,15,24
sôssô li ka mis a jour,mise à jour critique,22,20
kassa ti a ra,point dodeur de graillon,13,24
bwadɛl ka sira ka bɔ kwisia,rue des boisdels à cuisia,27,25
dɔrɔminbon wa,où dans le caveau,13,17
tilancɛ iris tilancɛ viɔlɛt,moitié iris moitié violette ,27,28
abe fleuri ka sira,rue abbé fleury à quintin,18,25
fichon cognac ka sira,rue henri fichon cognac,21,23
ne kadi môgô yé,moi je suis aimé,15,16
n ni min ye ɲɔvɔn sɔsɔ ban kan le yi n kamana gan,je suis assez éberluée par ce que j’entends sur les bancs de l’opposition,49,73
a sɛkɔra sarɛnt maritim kɔrɔyan fanfɛ kibariyaw kan,il reprend les informations locales des cantons du nord de la charentemaritime,51,78
a bi bibliotɛki barakɛra a ka kalan wagatiw ra,il travaille pendant ses études comme bibliothécaire et dans un entrepôt,46,72
adama denn bè ni ka kèwali,en outre son train atterrissage a été repensé et sa structure renforcée,26,71
mansar sira mugan ni fila sɛn brik fu fu fu,il existe aussi une méthode correspondante pour retrouver la clé secrète,43,72
limaŋ pɔntmɔr sira biduuru ni wolonfila selule biwɔrɔ ni saba kɛmɛ naani,cinquantesept rue de la limagne pontmort soixantetrois deux cents cellule,72,73
waldɛk primɔn ka gɔrze viktɔr ya dilan furu nɔn fɛ,le prince georgesvictor de waldeckpyrmont la crée à la suite du mariage,50,71
a manakɛ cogo cogo nin ye sarl mɔgɔtɔrɔlaye,quoi qu’il en soit c’est là la preuve d’une improvisation assez perturbante et troublante,43,89
antrefa kɛmɛsaba ni binani ni seegi,chemin dentraigues au numéro trois cent quarantehuit,35,52
ni bèyé tèmè sira lo yé,soixantedeux rue hubert delisle quatrevingtdixsept quatre cent dixhuit le tampon,23,80
sodassou bi gêrê la,les matelots s’avancent,19,23
kalé bina kè mèri yé yani san dama bi,la plupart des compositions sont anonymes,37,41
n ya ka jɛkulu ni tɔnɔ fɔ ka gɛlɛya,j’insiste sur l’importance de ces amendements identiques de coordination,35,72
a be gugɛn sira biduru ni saaba ra,raul hilberg tout comme léon poliakov fut un pionnier de l’histoire de la shoah,34,79
n ka fɔli kɔrɔsi i bi se ka toka anbrase dɔɔni,prends donc garde à mon col… tu peux bien embrasser sans te suspendre…,46,70
balkrez bi toulon kɛra,valcreuse tout en jouant aux cartes,22,35
petini a ya ɲan sigi kɔnɔna pɔrti nin na ka lɔ,pétunia se dirige vers la porte du fond et s’arrête,46,51
o ra a bi na paranuyak kɛwalen dɔ sugandi,vous inventez pour cela un mécanisme paranoïaque,41,48
nin ye anzelin min tun bi lɔgɔ ni tɔmɔna ka kalifa muni ma,il confiait angeline à noémie qui maniait un énorme bâton ramassé là,58,68
aw ya janto a bi fɛ ka marali min kɛ sisan yi la,vous vous gargarisez des économies que vous vous décidez enfin à faire,48,70
n ti na nin wariko ni kalifa sariya ma,nous proposons de garantir ce financement par la loi,38,52
flibustiers bɛ tagara an yɛn,des flibustiers avancent,28,24
impôt bi môgô bougô,quand on parle de matraquage fiscal c’est la réalité,19,52
a fana yi strimèr yé télé kan,il est aussi streamer sur la chaîne twitch lestream,29,51
na ya kôrô yala a bi sôrô,le pathologique peut précisément se définir par la rigidité des défenses,25,72
o ka sèbè bi sôrô yanfè,la liste des distinctions littéraires est disponible sur le site des éditions,23,77
wa kèmè ni mougan,trois cent soixantedeux route de belfond quatrevingtdixsept mille cent vingt saintclaude,17,88
nla bila i ka mè wa,quelques interprétations ont été effectuées et enregistrées donnant ainsi une idée globale de lœuvre,19,100
aba gongai lon kodjougou,rue des abbés gaugain cinquantetrois cent soixante hambers,24,58
nafa bara kodjougou,lalbum est un succès tant auprès du public que des critiques,19,60
tèmè sira wèrè beyi,cinq cent trentedeux avenue du brassenx quarante cent dix à ygossaintsaturnin,19,77
a bi semblant kèra,ceuxci sont remarquablement semblables à larbalète médiévale postérieure,18,72
a bi na yè,si ça y était ce serait entre zébré et zébrure,10,46
obi fèka yèlèma yan,ils replacèrent la perruque dessus la retirèrent de nouveau lajustant de toutes sortes de façons,19,96
a toumbi belle ville la le,elle appartient à lunité urbaine de belleville au nord de laire urbaine de lyon,26,79
wagati dama ni lo,le temps était maniable,17,24
a kun ka di n ye ka yelen sɔrɔ nunu barakɛlaw ka misiyɔn ra,je souhaite être précis s’agissant des missions et des profils de ces salariés,59,78
wotoro kelen walima sarɛti kelen hɛr tilancɛ bɛ,à peine une charrette ou un roulier tous les quarts d’heure,47,60
ni sine ba fɛ a bi se ka filmu nunu la degi kɛ,la copie pirate des films pouvant même seffectuer si besoin en chine,46,68
mɔndrɛl sira mugan ni wɔrɔ turuvre wabiwɔrɔ ni kelen ni kɛmɛ ani bikɔnɔntɔn,vingtsix rue mondrel soixante et un mille cent quatrevingtdix tourouvre,75,71
cɔnfɛransi kelen min n ya kɛ sine n ye o le kɛ sili,jai donné exactement les mêmes conférence en chine quau chili,51,61
lɔnni ba fɛ crɔss triatlɔl ni ɛkstera la,il est spécialisé dans le cross triathlon et la série xterra,40,60
kongerans kelen mi ye i ya di sin i yo le di sili,la piste aujourdhui est réfrigérée artificiellement,49,51
ni koni kôrô toun be washint dougou ra,une part significative se trouve dans le nevada et dans létat de washington,38,75
o bi bena yiri kan,les aiguilles se décolorent également et tombent de l’arbre infecté,18,67
arbepɛn ka sira tan ni fila,douze rue de larbepin,27,21
dɔnkili dɔw togo ye anrezistreman kɔrɔmanw le ye,certains titres sont de nouveaux enregistrements danciennes chansons,48,68
nin kɛra koba ye makɔrɔbaw ka singiman la jɛkulula,il sagit de la plus grosse production épique de lhistoire du cinéma pour adulte,50,79
sanou cɔcɔkalo gɛrɛfɛ,à cet effet arrive miaoût l,21,27
nin koni bi fara faragwɛla ka komediɛn dɔ ye a tɔgɔ ko izabɛl hipɛr,la maîtresse de cérémonie est lactrice française isabelle huppert,67,65
sa min nuw bi tasuma bɔ dala u yo ɲoti ka tɛmɛ,elles écartaient les bottes des dragons,46,39
faragwɛla ka livru ka parti denin dɔ kɛra faragwɛlɛla kama,ouvrage en français avec une partie en breton non traduite en français,58,70
a tun ye balontanla ye,il évolue au poste dailier à platinum stars,22,43
joanɛr ka sira biwɔrɔ ani kelen,rue de la jéhannière soixante et un cent flers,31,46
cogodira o ye mɔgɔ wɛrɛ ye,comment un autre prétendu …,26,27
nin miriya nin bi ne fɛ ka filɛ kɔfɛ,cette idée me paraît néanmoins devoir être explorée par la suite,36,64
viabon ye dugusen kura ye,le cheflieu de la commune nouvelle est viabon,25,45
ora a yɛrɛkɛni be yi o ɲa gɛrɛfɛla la,plutôt plat il a une épaisseur de environ,37,41
julus pagozus ya k ka plasi ta dugu ɲanaman sen na,il est remplacé le par le socialdémocrate julius pagojus,50,56
o bi tama tama na caama na sans gwɛrɛfɛyɔrɔ la,ils effectueront davantage dexplorations dans un avenir proche,46,62
masacɛ tunyi kɔnɔni kɛ ka sinɔgɔ dugu senw na miniw ba gɛrɛfɛ,le roi au contraire avait attendu dormi soupé dans les villages voisins,61,71
a yi bɔnbuw tiɲɛ a makoya ma se kogo ma,il détruit tes ogives nucléaires sans se servir du mur,39,54
gwɛlɛya sera wɛrɛwɛrɛkow ma pɛtra dugu ra ani zɔrdani dugu ra,le drame se produit lors dune excursion à pétra en jordanie,61,59
an ka dougou papier bi kè yan le,son siège administratif est situé à gianyar,32,43
segé segé taraa ka foro bi na tchien,oui sans faute sa vigne mourra» tel est le mot du paysan,36,56
nunu mɔgɔsɔsɔla nunu bi kumacaaman kɛ,ces courtisans font l’objet de railleries,37,41
ka na den wolon lorelayi ka gwɛlɛya sababu la,tu ponds un cornet cohérent par la faute de la lorelei,45,54
politikikɛla cɛ nin tun bi koloni jamana na,lhomme politique a résidé dans la colonie,43,41
n yi fɛ a tɔgɔ ka sɛbɛ sariya kɔnɔ,je ne veux pas qu’il soit inscrit dans la loi,34,45
judas ka sira,un chemin du poirier judas,13,26
chichi doni bôra ka yorô bè ta,de chaudes buées filtrent en maint endroit,30,43
sira lo bi yan fè,rue du clos des alouettes à boynes,17,34
a bi pili fere a,vous vendez des piles ,16,22
fɔyɔnba nin tun bale le kan,les ouragans étaient sur lui,27,29
nin le ra ne niminsa ra n ka diɲɛlatigɛ ra,c’est le regret de ma vie…,42,26
a yi kravati ɲanaman fla san,acheter deux cravates solides,28,29
koni bi kɛra pɔri la,laction se déroule au port,20,26
tile tan ni kɔnɔtɔn nan de ye tan ni kelen ye,bataille de tann le dixneuf,45,27
nne bi na munumunu,moi jentourerai,18,15
n ye n ga deenmusu pyni,jai puni ma fille,23,17
a tiɲɛni san mugan le yi,brouillés depuis vingt ans,24,26
pybilisite boon magwɛrɛ yɔngɔn na,la publicité les rapproche,33,26
a tun be wari bisaba le sɔrɔ,elle gagnait trente sous,28,24
a ye yɛrɛsigɛn dabila,cessez de ramer,21,15
n bi sira dari,je demande le retrait,14,21
walasa nin kana di,pour ne pas servir ceuxci,18,25
kanu ɲɔngɔn minw bɔni lo ɲɔgɔman,les amoureux assortis,32,21
a ma na kɛ barinan kooko ye,quel que soit lobstacle,27,23
onhon a tun ba famu,oui elle le comprenait,19,22
irbɛn seegira kan,urbain renchérit làdessus,17,25
i ba ko ɲanabɔ tile tan ni duuru kɔnɔ,tu le traites quinze jours…,37,27
a bi lafiɛn na bɛrlin,il repose à berlin,21,18
nanaman kow drɔn,rien que des idioties ,16,22
krzvɛn ka sira bose kɔnɔ,route de crevin à bossey,24,24
a le bi na mɔgɔ kanu,toi tu aimeras,20,14
o bi kɛ i dɔgɔmuso fɛ,elles aimeraient ta sœur,21,24
n kɔni ba don,je le sais moi,13,14
a ka sigi yɔrɔ bi madrid le,son siège est situé à madrid,27,28
hɛri tan ni kelen ni klancɛ le dira o ma,il est onze heures et demi,40,26
tiskola le ye i sigi yɔrɔ ye,son siège est tuscola,28,21
pan kelen trɛn fla cɛ,un saut entre deux trains ,21,26
lafiti ya ta don a yɛrɛ kun,laffitte enfila le sien,27,23
nin tun bi se ka kelen sɔrɔ,jaimerais en avoir une,27,22
n kaɲi ka joli le di aw ma,combien je vous dois ,26,21
mɔgɔ kun fin tan ni duuru,une quinzaine d’hurluberlus,25,27
nɛgɛ kanɲan kɔnɔtɔn ni kilancɛ,neuf heures et demie …,30,22
ka se ka fɛn dɔ ɲinikali kɛ,pour demander quelque chose,27,27
a tuma se ra tumaba se ra,il est temps grand temps …,25,26
nin drɔn pe le tun kadi aninkuye,cela seul passionnait son âme,32,29
an bi mun kuma le ra,de quoi parleton ,20,17
nin jurne ni daminɛ cogo kaɲ,la journée s’annonce belle,28,26
i lanibara ka bi na diya a ye,tu es sûr que vous aimerez,29,26
ni a yɔrɔ kan jan o le ka fisa,plus c’est loin mieux c’est,30,27
a ye lɛtri nin do tasuma kɔnɔ,ii jette la lettre au feu,29,25
nin ne yi yɛlɛma,ça c’est le mouvement,16,21
an tun be jigɛ minɛ ni file ye,nous pêchions avec des filets,30,29
n mason ka n yɛrɛyira,je n’ai pas osé me manifester,21,29
oh ɲa cɛnumani,oh la bonne figure …,14,20
il tun te yi tuguni,d’île il n’y en avait plus,19,27
an ka jɛnkulu kɔnɔ mɔgɔ saaba,aucun homme de léquipage,29,24
a ko a ka dugu yala,fouillons le pays ditil,19,23
a bi siira sagaso juma le kɔnɔ,à quel étage habitezvous ,30,25
prɛntis le ya ka sigi yɔrɔ ye,son siège est prentiss,29,22
aw tina ji vɛri ɲakelen mi wa,prendrezvous un verre deau,29,26
an kaɲi ko dɛmɛ,nous devons donc les soutenir,15,29
ivan kuvida ka dokimantɛri,documentaire de yvan couvidat,26,29
musow bɛ ka janmijan,la plus grande femme,20,20
o ye prɛtri jalaki,ils accusèrent le prêtre,18,24
bitɛr yi polici wele,butters contacte la police,20,26
so den ne,cest lenfant de la maison,9,25
a sgi râ yan,thana retourne chez elle,12,24
alen a tun ba kalanna,elle elle lisait,21,16
laurence i ka fani yé wa,florence astu vu ma veste,24,25
né lé yi jean yé,jean c’est moi jean,16,19
môgô bissaba,une trentaine de personnes,12,26
a ka mousso bi bara kè mi,où travaille votre femme ,25,25
a toun bi yoro djoumê,où avaitil été ,21,15
ayi ibi baliman dè kouma mèna,non tu entends ton frère ,29,25
dumini kɛ yɔrɔ ni sɔgɔn man gɛlen ,ce restaurant n’est pas cher,34,28
a bi télé yan,c’est le cas ici,13,16
a bi koulé la ko ka don,—«entrez » criatil,23,18
a yan woulé ni lo,vous avez les yeux rouges,17,25
kalo kelen bara,un mois de travail,15,18
magazɛn da yɛlɛla a,les magasins sont ouverts ,19,26
a ba golora le,il l’a dans la peau,14,19
a bi kɔnɔkisɛ don,vous enfilez des perles,17,23
an ni ce kɔsɔbɛ,très bien merci,15,15
i bi mirila mune la,qu’estce que tu penses ,19,23
a kaɲi tan,c’est bien comme ça,10,19
o le kɔni,au fait c’est juste…,9,20
a ka doni ka ca dɛ,ils sont chargés,18,16
dabakala grigriman nin bi sɔrɔ aw fɛ wa ,vous avez des crayons gris ,40,27
aw jɔrɔnanko man caa wo,peu vous importe,23,16
ladili juman le balu fɛ,que recommandezvous ,23,20
disiki belebeleba bi fɛ wa,tu as un gros disque dur,26,24
a tun ba ka baradara kunu wa,vous étiez au bureau hier ,28,26
fla walema saaba,deux ou trois fois,16,18
bɛgɛn den mugan ani duuru,vingtcinq animaux,25,17
a bi di,comment estil ,7,14
galonw le,ce ne sont que des mensonges ,9,29
n ne ye île ta ye,cest celuici le tien,17,20
ne taw le,c’est les miennes,9,17
nɔnɔ litiri kelen ani klan,un demi litre de lait,26,21
i bi mulo kɛra,qu’estce que tu fais,14,20
an kaɲi ka telia jonathan,il faut aller vite,25,18
sini a bi na taga jigɛ minɛ yɔrɔ,demain elle pêchera,32,19
nin yaw ta le ye,ceci est à vous ,16,16
a ka ta fɔlɔ kɛra zɔrgi de ye,sa première sélection a eu lieu le face à la géorgie,29,52
a ye mule dayɛlɛ,qu’avezvous ouvert ,16,19
djolo yi sira di a ma,qui vous a permis …,21,19
kamelé déni mougan,des jeunes de vingt ans,18,23
anbi bara kè bi,où travailletil ,15,16
franswaz ka sira okamvil kɔnɔ,rue francoise à aucamville,29,26
macif ni ti na kɛ tuguni,le match ne reprendra pas,24,25
a tun ba sigɛn na dɔɔni,il en souffrait presque,23,23
n tun bi siko a ra tuma dɔra,j’en ai souvent rêvé,28,20
sira ka ɲi ka di mɔgɔw ka fɛtaw ma,il faut autoriser le choix,34,26
ka mu kɛ na ye,pour quoi faire ,14,16
see le ti an ye,il nous manque des moyens,15,25
n bi si yɔrɔ jumɛ le,où estce que j’habite ,20,22
ayi a yèrè soro ni koni na,cinq route du burg dixneuf deux cent quarante saintviance,26,57
a ba ka kobɛ kɛ a keleen ali a ka barada,ils improvisent donc seuls son service funèbre et sa crémation,40,62
a bɔra ,elle est sortie,7,15
bi avion conon nan,jattends mon avion à laéroport,18,30
lou kiura bin fè,j’ai bien une nouvelle maison,16,29
ni yèrè yi saga yé,en réalité cest un mouton,18,25
wari dôni,un peu dargent,9,14
dogô mousso djoli lo bi i fè,combien de sœurs avezvous ,28,26
cuillère deni,la petite cuillère,13,18
ko yanan man ba,une très bonne chose,15,20
mousso a bana râ,il a refusé madame…,16,19
ni ne tayé,cest celuilà le mien,10,20
couleur djoumè lo,cest quelle couleur ,17,20
a koun ti se tougou,il nen pouvait plus,19,19
touma bè bougê li bi kè,tout à coup on frappe,23,21
touma djoumè tougou ni,combien de temps encore ,22,24
nne le ye obama muso ye,je suis madame obama,23,20
aviɔn beleba mugan,les vingt avions sont gros,18,26
o tun yo kanu,ils ont été aimés,13,17
a tun bi mulo fɔra ye,qu’atelle pu dire …,21,19
diɲɛlatigɛ yɛlɛmana,sa vie en fut changée,19,21
ka ni yɛrɛ sigɛn tuguni,eh bien ne te gêne plus,23,23
tiɲɛtɛ,ce n’est pas vrai,6,17
a bamuso ka kɛnɛ,comment va votre mère ,16,22
sira dumu wagati,à l’heure du dîner,16,18
muso wolofila ɲɔngɔnkɔ,elles sont sept sur les rangs,22,29
a bi na tericɛ jumaw sɔrɔ,quels copains vatil avoir,25,25
aw ba lɔn a,vous la connaissez ,11,19
a diara o ye,eux ils ont aimé,12,16
wari dɔɔnin,un peu dargent,11,14
an bi kɔ fɛ,nous avons du retard,11,20
an lɔra ka mɛn,vous avez attendu longtemps ,14,28
jaa nin kɔrɔsi ni no,cest un monument protégé,20,24
i facɛ ka jan,ton père est grand,13,18
jumɛ le tora,qu’en restetil,12,14
i ni cee i ka hakili jigira,merci de me lavoir rappelé,27,26
